{
  "sessionId": "05945c50-1852-4880-957c-60804cc27e73",
  "projectHash": "c4abe05c34e00ad6756d9ef535af72794649bc05d7b1a9de39e16e714efe71ce",
  "startTime": "2025-11-17T02:39:15.506Z",
  "lastUpdated": "2025-11-17T02:39:15.507Z",
  "messages": [
    {
      "id": "56bdb90f-89c1-4aad-a6c4-96631b857148",
      "timestamp": "2025-11-17T02:39:15.507Z",
      "type": "user",
      "content": "i want to put this to my remote cloobfm git repo with splitrail as the same name"
    }
  ]
}